{
  "schema_version": "vvfp.expanded_256_save_serializer_abi_evidence.v1",
  "contract_id": "x45-vv4-vv5-expanded-256-save-serializer-abi-evidence",
  "status": "evidence_empty_stop",
  "integrity": {
    "canonicalization": "UTF-8 JSON with sorted keys and compact separators; integrity.canonical_sha256 is excluded from its own digest",
    "canonical_sha256": "362B36C79014B8A8ABB156D105539BD9F2E095A20C208ED665B2345F30FCA8DE"
  },
  "publication": {"enabled": false, "runtime_go": false, "player_go": false, "eligible": false},
  "policy": {
    "qualifying_evidence_class": "authenticated_native_and_player_runtime_receipt",
    "forbidden_evidence_classes": ["synthetic", "manual_injection", "static_description", "inferred"],
    "required_native_fields": ["row_id", "requirement", "function_name", "function_ea", "instruction_ea", "file_offset", "preimage", "calling_convention", "return_semantics", "failure_semantics", "xrefs", "artifact", "runtime_receipt_refs", "player_receipt_refs", "synthetic"],
    "completion_rule": "Every requirement must be observed_complete with an exact expected row count, canonical row-ledger digest, exact native rows, an authenticated complete-folder receipt, authenticated runtime receipts, and explicit player receipts. Any absent, partial, unknown, synthetic, manually injected, static-only, stale, or unauthenticated evidence is STOP.",
    "native_emission": false
  },
  "bindings": {
    "implementation_base_commit": "9ffa0c21277df3b8dabee81fb0316e6953695ed3",
    "schema": {"path": "data/schemas/expanded_256_save_serializer_abi_evidence.schema.json", "file_sha256": "5FD0DB0E6E12AB723F762EA2B31FD9F313ABCDE4239A3F85142BC6E21AEB9C69"},
    "stored_index_contract": {"path": "data/expanded_256_stored_index_evidence.json", "file_sha256": "EF86594D3FCC6DFB4FA7599D770E634008C6975C8A45E9824FD26E87F198A4DC", "canonical_sha256": "4A8C0554B495651ABF951E71D6DC481382929CBF8FA9A0EF9182CEA5C165B54D"},
    "runtime_contract": {"path": "data/expanded_256_runtime_evidence.json", "file_sha256": "BB90E24579DB33A118779A2EACC939D96DDCD8392C9C759CB9B373B8DFEB4DF3", "canonical_sha256": "44006789E82B4C92C9940B8B33ED3AFDFCA45EB25DF774F22156AEF9FF7392E8"},
    "runtime_harness": {"path": "scripts/capture_expanded_runtime_evidence.py", "file_sha256": "719DAD95AC6AB2D2E1CC9F64DECF1BB894CC4A98B5B7662A3A84402B2C5CA321", "schema_version": "vvfp.expanded_256_runtime_capture.v1"}
  },
  "required_requirements": [
    "save_layout_sizes", "loader_abi", "stock_import_conversion", "writer_record_count_tail", "serializer_bounds", "deserializer_bounds", "padding_non_saveability", "integrity_transform", "slot_rotation_atomicity", "failed_load_nonmutation", "offline_catchup_ordering", "manager_pool_identity_reload", "current_origins_behavior", "complete_folder_runtime_player_receipts"
  ],
  "games": {
    "vv4": {
      "stock_fingerprint": {"filename": "Virtual Villagers - The Tree of Life.exe", "size": 929792, "sha256": "6D27A429FFCA5F1F71FDD7ECA761ED1BB67E85F976494BA178B3D7BE01F1B220"},
      "expanded_fingerprints": {"experimental_expanded_256": {"size": 929792, "sha256": "602824F514BFAB80883805B16C01D1E572752261A155262778CF8D535C41D887"}, "experimental_expanded_256_progression": {"size": 929792, "sha256": "AC430442DE23406236903CAA6FC9A992D52DCF3269A95ED345A9EF6F18B9C30A"}},
      "relocation_ledger": {"path": "data/vv4_origins_feature.json", "file_sha256": "5A59BE484D22B1140DB532A520ADD9481D378159AF648803B3649A95590ECDFB", "count": 13, "ledger_sha256": "CEE01F4AEC59CB1CEE0F42E3DDDB3A24615261E628ED0629C1BFAABF421A897D"},
      "complete_folder": {"status": "absent_stop", "inventory_sha256": null, "authenticated": false},
      "save_layout": {"stock_size": null, "expanded_size": null, "stock_layout_sha256": null, "expanded_layout_sha256": null, "status": "unknown_stop"},
      "evidence_matrix": [
        {"requirement": "save_layout_sizes", "status": "unknown_stop", "expected_row_count": null, "row_ledger_sha256": null, "native_rows": [], "runtime_receipt_refs": [], "player_receipt_refs": [], "missing_evidence": ["exact authenticated native rows and exact artifact", "authenticated complete-folder/runtime/player receipts"]},
        {"requirement": "loader_abi", "status": "unknown_stop", "expected_row_count": null, "row_ledger_sha256": null, "native_rows": [], "runtime_receipt_refs": [], "player_receipt_refs": [], "missing_evidence": ["exact authenticated native rows and exact artifact", "authenticated complete-folder/runtime/player receipts"]},
        {"requirement": "stock_import_conversion", "status": "unknown_stop", "expected_row_count": null, "row_ledger_sha256": null, "native_rows": [], "runtime_receipt_refs": [], "player_receipt_refs": [], "missing_evidence": ["exact authenticated native rows and exact artifact", "authenticated complete-folder/runtime/player receipts"]},
        {"requirement": "writer_record_count_tail", "status": "unknown_stop", "expected_row_count": null, "row_ledger_sha256": null, "native_rows": [], "runtime_receipt_refs": [], "player_receipt_refs": [], "missing_evidence": ["exact authenticated native rows and exact artifact", "authenticated complete-folder/runtime/player receipts"]},
        {"requirement": "serializer_bounds", "status": "unknown_stop", "expected_row_count": null, "row_ledger_sha256": null, "native_rows": [], "runtime_receipt_refs": [], "player_receipt_refs": [], "missing_evidence": ["exact authenticated native rows and exact artifact", "authenticated complete-folder/runtime/player receipts"]},
        {"requirement": "deserializer_bounds", "status": "unknown_stop", "expected_row_count": null, "row_ledger_sha256": null, "native_rows": [], "runtime_receipt_refs": [], "player_receipt_refs": [], "missing_evidence": ["exact authenticated native rows and exact artifact", "authenticated complete-folder/runtime/player receipts"]},
        {"requirement": "padding_non_saveability", "status": "unknown_stop", "expected_row_count": null, "row_ledger_sha256": null, "native_rows": [], "runtime_receipt_refs": [], "player_receipt_refs": [], "missing_evidence": ["exact authenticated native rows and exact artifact", "authenticated complete-folder/runtime/player receipts"]},
        {"requirement": "integrity_transform", "status": "unknown_stop", "expected_row_count": null, "row_ledger_sha256": null, "native_rows": [], "runtime_receipt_refs": [], "player_receipt_refs": [], "missing_evidence": ["exact authenticated native rows and exact artifact", "authenticated complete-folder/runtime/player receipts"]},
        {"requirement": "slot_rotation_atomicity", "status": "unknown_stop", "expected_row_count": null, "row_ledger_sha256": null, "native_rows": [], "runtime_receipt_refs": [], "player_receipt_refs": [], "missing_evidence": ["exact authenticated native rows and exact artifact", "authenticated complete-folder/runtime/player receipts"]},
        {"requirement": "failed_load_nonmutation", "status": "unknown_stop", "expected_row_count": null, "row_ledger_sha256": null, "native_rows": [], "runtime_receipt_refs": [], "player_receipt_refs": [], "missing_evidence": ["exact authenticated native rows and exact artifact", "authenticated complete-folder/runtime/player receipts"]},
        {"requirement": "offline_catchup_ordering", "status": "unknown_stop", "expected_row_count": null, "row_ledger_sha256": null, "native_rows": [], "runtime_receipt_refs": [], "player_receipt_refs": [], "missing_evidence": ["exact authenticated native rows and exact artifact", "authenticated complete-folder/runtime/player receipts"]},
        {"requirement": "manager_pool_identity_reload", "status": "unknown_stop", "expected_row_count": null, "row_ledger_sha256": null, "native_rows": [], "runtime_receipt_refs": [], "player_receipt_refs": [], "missing_evidence": ["exact authenticated native rows and exact artifact", "authenticated complete-folder/runtime/player receipts"]},
        {"requirement": "current_origins_behavior", "status": "unknown_stop", "expected_row_count": null, "row_ledger_sha256": null, "native_rows": [], "runtime_receipt_refs": [], "player_receipt_refs": [], "missing_evidence": ["exact authenticated native rows and exact artifact", "authenticated complete-folder/runtime/player receipts"]},
        {"requirement": "complete_folder_runtime_player_receipts", "status": "unknown_stop", "expected_row_count": null, "row_ledger_sha256": null, "native_rows": [], "runtime_receipt_refs": [], "player_receipt_refs": [], "missing_evidence": ["exact authenticated native rows and exact artifact", "authenticated complete-folder/runtime/player receipts"]}
      ]
    },
    "vv5": {
      "stock_fingerprint": {"filename": "Virtual Villagers - New Believers.exe", "size": 991232, "sha256": "92946781980220E9D1A2E6C573925519934608F5215F4A0F8CE3B90088C5C65D"},
      "expanded_fingerprints": {"experimental_expanded_256": {"size": 991232, "sha256": "44042572653782B20A200799785F437D4D76B46F20384D597B8093F27CC88C89"}, "experimental_expanded_256_progression": {"size": 991232, "sha256": "6BF9E0EB9BC7D3C373E32C3A7377C9A7EA35C1FA889EEDBF9B2819A25BC43E86"}},
      "relocation_ledger": {"path": "data/vv5_origins_feature.json", "file_sha256": "A724796591D776700FB61A38171E4214A1042048E93042CD812B0441FA708865", "count": 66, "ledger_sha256": "14E460773ADC065E053FA30921ED01D33A5F36AD49DC754CCD69127EA02C01B7"},
      "complete_folder": {"status": "absent_stop", "inventory_sha256": null, "authenticated": false},
      "save_layout": {"stock_size": null, "expanded_size": null, "stock_layout_sha256": null, "expanded_layout_sha256": null, "status": "unknown_stop"},
      "evidence_matrix": [
        {"requirement": "save_layout_sizes", "status": "unknown_stop", "expected_row_count": null, "row_ledger_sha256": null, "native_rows": [], "runtime_receipt_refs": [], "player_receipt_refs": [], "missing_evidence": ["exact authenticated native rows and exact artifact", "authenticated complete-folder/runtime/player receipts"]},